{
  "contract_version": "1.0.0",
  "subject_type": "variant",
  "resolution": "PROBABLE",
  "canonical_id": null,
  "candidate_ids": [301],
  "confidence_score": 0.71,
  "reason_codes": ["candidate_generation_only"],
  "resolver_version": "entity-resolution-shadow-v1",
  "policy_version": "entity-resolution-policy-v1",
  "evidence": [
    {
      "raw_source_record_id": 31,
      "source_type": "awin_feed",
      "source_ref": "awin-feed:42",
      "observed_at": "2026-09-01T00:02:00Z",
      "signal": "title",
      "field": "title",
      "normalized_value": "wireless headphones black",
      "strength": "weak",
      "role": "candidate_only",
      "transformation": "normalize_title",
      "transformation_version": "v1"
    }
  ],
  "conflicts": []
}
