{
  "contract_version": "1.0.0",
  "subject_type": "variant",
  "resolution": "EXACT_VERIFIED",
  "canonical_id": 321,
  "candidate_ids": [321],
  "confidence_score": 1.0,
  "reason_codes": ["exact_global_identifier"],
  "resolver_version": "entity-resolution-shadow-v1",
  "policy_version": "entity-resolution-policy-v1",
  "evidence": [
    {
      "raw_source_record_id": 17,
      "source_type": "awin_feed",
      "source_ref": "awin-feed:42",
      "observed_at": "2026-09-01T00:00:00Z",
      "signal": "gtin",
      "field": "gtin",
      "normalized_value": "4006381333931",
      "strength": "exact",
      "role": "primary",
      "transformation": "normalize_gtin",
      "transformation_version": "v1"
    }
  ],
  "conflicts": []
}
