{
  "contract_version": "1.0.0",
  "subject_type": "product_model",
  "resolution": "UNRESOLVED",
  "canonical_id": null,
  "candidate_ids": [],
  "confidence_score": null,
  "reason_codes": ["insufficient_evidence"],
  "resolver_version": "entity-resolution-shadow-v1",
  "policy_version": "entity-resolution-policy-v1",
  "evidence": [
    {
      "raw_source_record_id": 50,
      "source_type": "awin_feed",
      "source_ref": "awin-feed:42",
      "observed_at": "2026-09-01T00:05:00Z",
      "signal": "brand",
      "field": "brand_name",
      "normalized_value": "example",
      "strength": "weak",
      "role": "candidate_only",
      "transformation": "normalize_brand_label",
      "transformation_version": "v1"
    }
  ],
  "conflicts": []
}
